{
    "id": "123e4567-e89b-12d3-a456-426655440000",
    "creation_date_time": "2013-02-05T07:25:00Z",
    "schema_id": {
        "namespace": "omh",
        "name": "physical-activity",
        "version": "1.1"
    },
    "acquisition_provenance": [
        {
            "source": {
                "device": {
                    "name": "Charge HR",
                    "manufacturer": "Fitbit",
                    "model": "Charge HR",
                    "id": "27072629"
                }
            },
            "placement": "left wrist",
            "source_creation_date_time": "2013-02-05T07:25:00Z",
            "modality": "sensed"
        },
        {
            "source": {
                "application": {
                    "name": "Map My Run",
                    "id": "291890420",
                    "provider": "UnderArmour",
                    "version": "17.2.2",
                    "url": "http://itunes.apple.com/us/app/imapmyrun/id291890420/?mt=8",
                    "platforms": [
                        {
                            "os": {
                                "type": "iOS"
                            },
                            "version": {
                                "type": "9.3.5"
                            }
                        }
                    ]
                }
            },
            "source_creation_date_time": "2013-02-05T07:25:00Z",
            "modality": "sensed"
        },
        {
            "source": {
                "application": {
                    "name": "Map My Fitness",
                    "id": "291890420",
                    "provider": "UnderArmour",
                    "version": "17.7.1",
                    "url": "https://itunes.apple.com/us/app/map-my-fitness-gps-workout-trainer-tracker/id298903147?mt=8",
                    "platforms": [
                        {
                            "os": {
                                "type": "iOS"
                            },
                            "version": {
                                "type": "9.3.5"
                            }
                        }
                    ]
                }
            },
            "source_creation_date_time": "2013-02-05T07:25:00Z",
            "modality": "sensed"
        }
    ],
    "handedness": "left handed",
    "user_id": "user1432"
}